2018,"Desarrollo de los programas de gestión para mejorar la calidad del aire (Proaire) en los estados de Aguascalientes, Campeche, Oaxaca, Quintana Roo y Zacatecas","DGRMIS-DAC-DGGCARETC-001/2018 – Servicios ambientales integrales de consultoría y cambio climático, S.C. · DGRMIS-DAC-DGGCARETC-002/2018 – Ambiens Consultoría, Sustentabilidad y Gestión Climática, S.A. de C.V. · DGRMIS-DAC-DGGCARETC-003/2018 – Kuradzo, Ingeniería Ambiental, S.C."," $5,000,000.00 ",Dirección General de Gestión de la Calidad del Aire y Registro de Emisiones y Transferencia de Contaminantes,http://aplicaciones.semarnat.gob.mx/SicoseIntranet/ProductosEsperados/64854_2019_Primer_entregable.pdf
2018,"Elaboración del Libro Blanco de las acciones y obras realizadas y en proceso, para el manejo ambientalmente adecuado de residuos y remediación del sitio contaminado en la Ex Unidad Industrial Fertimex, Salamanca, Guanajuato.",CONTRATO DGRMIS-DAC-DGGIMAR-003/2018," $150,000.00 ",Dirección General de Gestión Integral de Materiales y Actividades Riesgosas,http://aplicaciones.semarnat.gob.mx/SicoseIntranet/ProductosEsperados/65825_2018_LIBRO_BLANCO.pdf
2018,"Evaluación de Impacto Ambiental del proyecto Transporte masivo en la modalidad de Tren Toluca-Valle de México, entre el Estado de México y el Distrito Federal.", Consultor Independiente ," $150,000.00 ",Dirección General de Impacto y Riesgo Ambiental,http://aplicaciones.semarnat.gob.mx/SicoseIntranet/ProductosEsperados/65086_2018_Libro_Blanco_del_Tren_Toluca_-_Valle_de_México.pdf
2018,"Asesoria externa de Seguros 2018, para la contratación de las pólizas de los bienes patrimoniales de la SEMARNAT, incluyendo apoyo administrativo y gestiones ante las aseguradoras",Grupo CIDAR Business Brokers," $90,000.00 ","Dirección General de Recursos Materiales, Inmuebles y Servicios",http://aplicaciones.semarnat.gob.mx/SicoseIntranet/ProductosEsperados/65948_2019_Entregable_5.7v2.pdf
2018,"Estudio Justificativo para el establecimiento de un Área de Refugio para proteger Especies Acuáticas Migratorias y en Alguna Categoría de Riesgo, con el objeto de conservar y contribuir a su desarrollo y proteger su hábitat en una porción del Pacífico Sudcaliforniano","BETA Diversidad, A.C."," $480,000.00 ",Dirección General de Vida Silvestre,http://aplicaciones.semarnat.gob.mx/SicoseIntranet/ProductosEsperados/65832_2019_1er_reporte_ETJ_Refugio_Pacífico_Sudcaliforniano.pdf
2018,Consultoria para la Integración de los Principales Logros de la SEMARNAT 2012 - 2018,Rodolfo Morari Saldivar," $440,000.00 ",Oficina del C. Secretario,http://aplicaciones.semarnat.gob.mx/SicoseIntranet/ProductosEsperados/66504_2018_Legado_de_M%C3%A9xico_V3.pdf
2018,Evaluación de Procesos del Programa Presupuestario G003 Regulación Ambiental,CRS Consultor Independiente," $464,000.00 ",Subsecretaría de Gestión para la Protección Ambiental,http://aplicaciones.semarnat.gob.mx/SicoseIntranet/ProductosEsperados/66510_2018_Tercer_Informe_G003.pdf
2018,Estudio para evaluar los avances en la implementación de la herramienta de planeación “Estrategia Nacional de Calidad del Aire” y los pasos a seguir en su aplicación en el periodo 2019-2030.,"ARQUITECTURA DEL MEDIO AMBIENTE, S.A. DE C.V."," $410,000.00 ",Subsecretaría de Planeación y Política Ambiental,http://aplicaciones.semarnat.gob.mx/SicoseIntranet/ProductosEsperados/65862_2018_Reporte_ENCA_FINAL_Arquitectura_del_Medio_Ambiente.pdf
